ASIN,Product Title,Current Price,Original Price,Currency,Discount %,Savings Amount,URL,Image URL,Category,Brand,Prime
B007CDK0K8,Cleopatra - 50th Anniversary Edition (2-Disc),1499,1999,₹,25,500,https://www.amazon.in/dp/B007CDK0K8?tag=discount0e8e-21&linkCode=osi&th=1&psc=1,https://m.media-amazon.com/images/I/51iiz+lW96L._SL160_.jpg,MoviesAndTV,,false
B0DZ2K8575,All Out Mosquito Kill Racquet | 2X Faster Charging* | Mosquito Bat | Racket to Kill Mosquitoes Instantly | 6 Months Warranty | Long Lasting Battery | Recommended by Indian Medical Association,524,699,₹,25,175,https://www.amazon.in/dp/B0DZ2K8575?tag=discount0e8e-21&linkCode=osi&th=1&psc=1,https://m.media-amazon.com/images/I/51e-HJOZtDL._SL160_.jpg,GardenAndOutdoor,,false
B0DD8JS3L8,Handcrafted Wooden Paint Brush Stand For Artist,299,400,₹,25,101,https://www.amazon.in/dp/B0DD8JS3L8?tag=discount0e8e-21&linkCode=osi&th=1&psc=1,https://m.media-amazon.com/images/I/31hctCM4oML._SL160_.jpg,Collectibles,,false
B0CHX1W1XY,Apple iPhone 15 (128 GB) - Black,51990,69900,₹,25,17910,https://www.amazon.in/dp/B0CHX1W1XY?tag=discount0e8e-21&linkCode=osi&th=1&psc=1,https://m.media-amazon.com/images/I/31KxpX7Xk7L._SL160_.jpg,Electronics,,false
B0CWYX5MBY,Khola Pata Clay Thali Set | Handcrafted Terracotta Dinnerware | Bengali Red Plate & Bowls | Eco-Friendly | 7 Pcs | 1 Dining Set,1499,1999,₹,25,500,https://www.amazon.in/dp/B0CWYX5MBY?tag=discount0e8e-21&linkCode=osi&th=1&psc=1,https://m.media-amazon.com/images/I/417afMVw6aL._SL160_.jpg,Collectibles,,false
8172345666,The Power of Your Subconscious Mind: Original Classic Edition | Premium Paperback,149,199,₹,25,50,https://www.amazon.in/dp/8172345666?tag=discount0e8e-21&linkCode=osi&th=1&psc=1,https://m.media-amazon.com/images/I/41f1KlSQqNL._SL160_.jpg,Books,,false
B01IEVIVAC,"Yonex Mavis 200i Nylon Shuttle Cock, Pack of 6 (Yellow)",499,665,₹,24,166,https://www.amazon.in/dp/B01IEVIVAC?tag=discount0e8e-21&linkCode=osi&th=1&psc=1,https://m.media-amazon.com/images/I/41m9a4d0ilL._SL160_.jpg,SportsAndOutdoors,,false
B0D1KL34JM,Microsoft Office 2021 Professional - Lifetime Validity - Windows only - Email delivery in 2 Hours- no CD - Email Bind Key,1898,2499,₹,24,601,https://www.amazon.in/dp/B0D1KL34JM?tag=discount0e8e-21&linkCode=osi&th=1&psc=1,https://m.media-amazon.com/images/I/31ydjpiYM+L._SL160_.jpg,Software,,false
B0BYLK9PZC,P.N.Gadgil Jewellers 1 gm Vedhani Gold coin 24 kt (995),13655,17999,₹,24,4344,https://www.amazon.in/dp/B0BYLK9PZC?tag=discount0e8e-21&linkCode=osi&th=1&psc=1,https://m.media-amazon.com/images/I/3162roNX0yL._SL160_.jpg,Jewelry,,false
B07895T7B1,"McAfee Antivirus 2024 | 1 Device, 3 Year | Antivirus Internet Security Software | Email Delivery",685,899,₹,23,214,https://www.amazon.in/dp/B07895T7B1?tag=discount0e8e-21&linkCode=osi&th=1&psc=1,https://m.media-amazon.com/images/I/41KkGmKZcLL._SL160_.jpg,Software,,false
8187474548,I Am Nujood Age 10 and Divorced,138,180,₹,23,42,https://www.amazon.in/dp/8187474548?tag=discount0e8e-21&linkCode=osi&th=1&psc=1,https://m.media-amazon.com/images/I/41sbJJRbfZL._SL160_.jpg,MoviesAndTV,,false
B08Y1TQ8K7,"Duracell CR2032 Lithium Coin Battery, Pack of 5, Specialty Devices, Child Resistant Packaging, Electronic car Keys, Scale",153,200,₹,23,47,https://www.amazon.in/dp/B08Y1TQ8K7?tag=discount0e8e-21&linkCode=osi&th=1&psc=1,https://m.media-amazon.com/images/I/41G+Bi6ZtuL._SL160_.jpg,Computers,,false
B07ZZD6XL1,Genteel Matic Liquid Detergent Refill Pouch for Top load Washing - 2kg | No Soda Formula | with Added Fabric Conditioner,249,320,₹,22,71,https://www.amazon.in/dp/B07ZZD6XL1?tag=discount0e8e-21&linkCode=osi&th=1&psc=1,https://m.media-amazon.com/images/I/419MSDhdGGL._SL160_.jpg,Industrial,,false
B0B6Y3FNV7,"L'Oreal Paris Fresh Hyaluron Moisture 72HR Moisture Sealing Conditioner Powered By Hyaluronic Acid, For Frizz-Free, Hydrated And Bouncy Hair Full Of Life For All Hair Types | 175 Millilitres",188,239,₹,21,51,https://www.amazon.in/dp/B0B6Y3FNV7?tag=discount0e8e-21&linkCode=osi&th=1&psc=1,https://m.media-amazon.com/images/I/31i9VQAxpvL._SL160_.jpg,Beauty,,false
B0CXDQWYQP,Godrej aer O – Hanging Car Air Freshener – Assorted Pack of 3 (22.5g) | Gel Lasts up to 30 days | Car Accessories,234,297,₹,21,63,https://www.amazon.in/dp/B0CXDQWYQP?tag=discount0e8e-21&linkCode=osi&th=1&psc=1,https://m.media-amazon.com/images/I/41MzRsOk3PL._SL160_.jpg,Automotive,,false
B07WQJLYQM,"HIT Crawling Insect Killer Cockroach Killer Spray | Instant Kill | Deep-Reach Nozzle | Fresh Fragrance, 700ml",270,340,₹,20,70,https://www.amazon.in/dp/B07WQJLYQM?tag=discount0e8e-21&linkCode=osi&th=1&psc=1,https://m.media-amazon.com/images/I/41VhFzfC45L._SL160_.jpg,GardenAndOutdoor,,false
B0DCNWN8NZ,Apple EarPods (USB-C) ​​​​​​​,1599,2000,₹,20,401,https://www.amazon.in/dp/B0DCNWN8NZ?tag=discount0e8e-21&linkCode=osi&th=1&psc=1,https://m.media-amazon.com/images/I/21irBFnTYoL._SL160_.jpg,Electronics,,false
B00LXTFMRS,"Fevicryl Acrylic Colours Sunflower Kit | 10 Colours x 15 ml | DIY Paint, Rich Pigment | Multicolour & Multi-surface | Non-Cracking Paint for Canvas, Wood, Leather, Earthenware, Metal",201,250,₹,19,49,https://www.amazon.in/dp/B00LXTFMRS?tag=discount0e8e-21&linkCode=osi&th=1&psc=1,https://m.media-amazon.com/images/I/41F2ZOpEHvL._SL160_.jpg,OfficeProducts,,false
B01LNA2MQK,Dettol Liquid Handwash Refill - Original Hand Wash- 1350ml | Germ Defence Formula | 10x Better Germ Protection,176,219,₹,19,43,https://www.amazon.in/dp/B01LNA2MQK?tag=discount0e8e-21&linkCode=osi&th=1&psc=1,https://m.media-amazon.com/images/I/41UIlXu+B+L._SL160_.jpg,Industrial,,false
B00IZ932WG,Sparx mens SF0014G Navygrey Flip-flop - 8 UK (SF0014GNVGY0008),285,349,₹,18,64,https://www.amazon.in/dp/B00IZ932WG?tag=discount0e8e-21&linkCode=osi&th=1&psc=1,https://m.media-amazon.com/images/I/31NuHoH6lpL._SL160_.jpg,Shoes,,false
B0CQN2BHW8,"Amazon Fire TV Stick HD (newest model), Alexa Voice Remote with TV power & volume controls, full HD streaming device",4499,5499,₹,18,1000,https://www.amazon.in/dp/B0CQN2BHW8?tag=discount0e8e-21&linkCode=osi&th=1&psc=1,https://m.media-amazon.com/images/I/31jBqiTUjiL._SL160_.jpg,GiftCards,,false
8183286011,Dopamine Detox: A Short Guide to Remove Distractions and Get Your Brain to Do Hard Things,199,245,₹,18,46,https://www.amazon.in/dp/8183286011?tag=discount0e8e-21&linkCode=osi&th=1&psc=1,https://m.media-amazon.com/images/I/41CV+aTeWWL._SL160_.jpg,Books,,false
B0D14BB5XY,"PHILIPS Air Fryer NA120/00, uses up to 90% less fat, 1500W, 4.2 Liter, with Rapid Air Technology (Black), Large",4899,5995,₹,18,1096,https://www.amazon.in/dp/B0D14BB5XY?tag=discount0e8e-21&linkCode=osi&th=1&psc=1,https://m.media-amazon.com/images/I/31yUzU5r4oL._SL160_.jpg,Appliances,,false
B00PBX3L7K,Cosrx Advanced Snail 96 Mucin Power Essence (100ml),1199,1450,₹,17,251,https://www.amazon.in/dp/B00PBX3L7K?tag=discount0e8e-21&linkCode=osi&th=1&psc=1,https://m.media-amazon.com/images/I/310Qckf2ZtL._SL160_.jpg,LuxuryBeauty,,false
B01G0U6CO6,Fortune Dishwasher Active Salt Powder- 1 kg (Pack of 2),200,240,₹,16,40,https://www.amazon.in/dp/B01G0U6CO6?tag=discount0e8e-21&linkCode=osi&th=1&psc=1,https://m.media-amazon.com/images/I/41g2rJ4ddSL._SL160_.jpg,ToysAndGames,,false
B016VXORNA,"Scotch-Brite Sponge Wipe Resusable Kitchen Cleaning foam Cellulose wood Sponge- Easy to use, Multi- color & Biodegradable (pack of 5)",298,355,₹,16,57,https://www.amazon.in/dp/B016VXORNA?tag=discount0e8e-21&linkCode=osi&th=1&psc=1,https://m.media-amazon.com/images/I/51rTzjC7fYL._SL160_.jpg,ToolsAndHomeImprovement,,false
B084GNRLPW,"Pedigree Adult Wet Dog Food, Chicken & Liver Chunks in Gravy, 70 g (Pack of 30), Complete & Balanced Meal for Adult Dogs",1253,1500,₹,16,247,https://www.amazon.in/dp/B084GNRLPW?tag=discount0e8e-21&linkCode=osi&th=1&psc=1,https://m.media-amazon.com/images/I/41yLjmtyStL._SL160_.jpg,PetSupplies,,false
B01LZSWXWI,"Roff Cera Clean All Purpose Tile, Floor & Wall Cleaner 1 liter Pack of 1, Advance, Bedroom & Bathroom Floors, Removes Grease, Dirt & Tough Stains",187,225,₹,16,38,https://www.amazon.in/dp/B01LZSWXWI?tag=discount0e8e-21&linkCode=osi&th=1&psc=1,https://m.media-amazon.com/images/I/41AogZgxQhL._SL160_.jpg,Industrial,,false
B07FCHCQCW,"WD-40 Multipurpose Spray, Rust Remover, Cleans Bike Chains, Hinge Lubricant, Loosens Jammed Parts, Degreaser, and Cleaning Agent, 420ml (344.4g)",350,420,₹,16,70,https://www.amazon.in/dp/B07FCHCQCW?tag=discount0e8e-21&linkCode=osi&th=1&psc=1,https://m.media-amazon.com/images/I/41I6wmG-lYL._SL160_.jpg,Automotive,,false
B0BMGMP4N5,"Purepet Adult Dry Cat Food Mackerel Flavour, 1 kg Pack",169,199,₹,15,30,https://www.amazon.in/dp/B0BMGMP4N5?tag=discount0e8e-21&linkCode=osi&th=1&psc=1,https://m.media-amazon.com/images/I/41+q2+lL3GL._SL160_.jpg,PetSupplies,,false
B00LHULLKA,"Whiskas Junior Mother Cat & Kitten (2-12 Months) Dry Cat Food, Ocean Fish Flavour, 1.1 kg, Contains 41 Essential Nutrients, Complete & Balanced Nutrition for Mother Cats & Kittens",361,425,₹,15,64,https://www.amazon.in/dp/B00LHULLKA?tag=discount0e8e-21&linkCode=osi&th=1&psc=1,https://m.media-amazon.com/images/I/41EHzWntedL._SL160_.jpg,PetSupplies,,false
B07JQJFCS2,"Drools Absolute Dog Supplement Treat Calcium Bone Jar - 40 Pieces (600G Pack), For All Life Stages",387,460,₹,15,73,https://www.amazon.in/dp/B07JQJFCS2?tag=discount0e8e-21&linkCode=osi&th=1&psc=1,https://m.media-amazon.com/images/I/41EAv2BbnZS._SL160_.jpg,PetSupplies,,false
B00MVV81MK,"JK Copier Paper - A4, 75 GSM, 1 Ream, 500 Sheets",325,385,₹,15,60,https://www.amazon.in/dp/B00MVV81MK?tag=discount0e8e-21&linkCode=osi&th=1&psc=1,https://m.media-amazon.com/images/I/41Utcj-cw1L._SL160_.jpg,OfficeProducts,,false
B07MW4ZRJL,"L'Oréal Professionnel Xtenso Care Sulfate-free* Shampoo | For all hair types | Gently cleanses, controls frizz and adds shine | With Keratin Repair and Asta-Care *without sulfate surfactants",998,1175,₹,15,177,https://www.amazon.in/dp/B07MW4ZRJL?tag=discount0e8e-21&linkCode=osi&th=1&psc=1,https://m.media-amazon.com/images/I/310D+413VtL._SL160_.jpg,LuxuryBeauty,,false
B08KSPYJX2,"24K (999.9+) Purest 1 Gram Gold Bar, Lotus 1 gm Coin",13681,16100,₹,15,2419,https://www.amazon.in/dp/B08KSPYJX2?tag=discount0e8e-21&linkCode=osi&th=1&psc=1,https://m.media-amazon.com/images/I/41UmMCzctqL._SL160_.jpg,Jewelry,,false
B07VKM2HR5,"NIVEA Nourishing Body Milk 600ml Body Lotion with Hyaluronic Acid | 72Hr Hydration | Deep Moisture Care for Very Dry Skin | Enriched with Almond Oil | Smooth, Radiant & Healthy Looking Skin Care",380,448,₹,15,68,https://www.amazon.in/dp/B07VKM2HR5?tag=discount0e8e-21&linkCode=osi&th=1&psc=1,https://m.media-amazon.com/images/I/31g-kdcdSeL._SL160_.jpg,HealthPersonalCare,,false
B06VX8YR6Q,Ezee Black Garbage Bags for Dustbin | 90 Pcs | Medium 19 X 21 Inches | 30 Pcs x Pack of 3,169,199,₹,15,30,https://www.amazon.in/dp/B06VX8YR6Q?tag=discount0e8e-21&linkCode=osi&th=1&psc=1,https://m.media-amazon.com/images/I/41bJ6kzaXSL._SL160_.jpg,HomeAndKitchen,,false
B091Q7JNTC,Titan Minimals Quartz Analog with Date Black Dial Black Metal Strap Watch for Men - NT1806NM01,3396,3995,₹,14,599,https://www.amazon.in/dp/B091Q7JNTC?tag=discount0e8e-21&linkCode=osi&th=1&psc=1,https://m.media-amazon.com/images/I/41l3o8U2CfL._SL160_.jpg,Watches,,false
B06Y3WVH2X,L'Oréal Professionnel Serie Expert Absolut Repair Shampoo| For dry and damaged hair| Provides softness and shine | With Wheat Oil (90ml),675,790,₹,14,115,https://www.amazon.in/dp/B06Y3WVH2X?tag=discount0e8e-21&linkCode=osi&th=1&psc=1,https://m.media-amazon.com/images/I/31pMRYDwbwL._SL160_.jpg,LuxuryBeauty,,false
B01HVB3PSY,Bangalore Refinery 24k (999.9) 1 gm Yellow Gold Bar,13893,16200,₹,14,2307,https://www.amazon.in/dp/B01HVB3PSY?tag=discount0e8e-21&linkCode=osi&th=1&psc=1,https://m.media-amazon.com/images/I/41TZeb8tiTL._SL160_.jpg,Jewelry,,false
B08GZ6QNTC,Sony DualSense Wireless Controller White (PlayStation 5),5504,6390,₹,13,886,https://www.amazon.in/dp/B08GZ6QNTC?tag=discount0e8e-21&linkCode=osi&th=1&psc=1,https://m.media-amazon.com/images/I/31nh0udpAKL._SL160_.jpg,VideoGames,,false
B0CGJ2WTJR,"All Out Ultra Liquid Vaporizer, 4 Refills (45ml) | Kills Dengue, Malaria & Chikungunya Spreading Mosquitoes | India's Only Mosquito Killer Brand Recommended by Indian Medical Association",270,310,₹,12,40,https://www.amazon.in/dp/B0CGJ2WTJR?tag=discount0e8e-21&linkCode=osi&th=1&psc=1,https://m.media-amazon.com/images/I/41oQ0jDRWxL._SL160_.jpg,GardenAndOutdoor,,false
B01ESPB2WM,Motul Combo of C2 Chain Lube (150 ml) and C1 Chain Clean for All Bikes (150 ml) (LBCH001),420,480,₹,12,60,https://www.amazon.in/dp/B01ESPB2WM?tag=discount0e8e-21&linkCode=osi&th=1&psc=1,https://m.media-amazon.com/images/I/51H7z5BGMaL._SL160_.jpg,Automotive,,false
B0CTMP8FC3,MARS Edge of Desire Lip Liner | One Swipe Smooth Application | Long Lasting Lip Pencil (1.4gm) (14-CHOCO BUTTER),61,69,₹,11.59,8,https://www.amazon.in/dp/B0CTMP8FC3?tag=discount0e8e-21&linkCode=osi&th=1&psc=1,https://m.media-amazon.com/images/I/310Y7Pcl7TL._SL160_.jpg,Fashion,,false
B00XTSR652,Khushi's Pizza Magic Seasoning 50g – 100% Natural Pizza & Pasta Spice Mix | No Preservatives | Enhances Italian Flavors.,70,79,₹,11,9,https://www.amazon.in/dp/B00XTSR652?tag=discount0e8e-21&linkCode=osi&th=1&psc=1,https://m.media-amazon.com/images/I/618lom4xUJL._SL160_.jpg,Music,,false
B01CCGW4OE,"Cetaphil Paraben, Sulphate-Free Gentle Skin Hydrating Face Wash Cleanser with Niacinamide, Vitamin B5 for Dry to Normal, Sensitive Skin - 125 ml",378,429,₹,11,51,https://www.amazon.in/dp/B01CCGW4OE?tag=discount0e8e-21&linkCode=osi&th=1&psc=1,https://m.media-amazon.com/images/I/31K5tBuI3ZL._SL160_.jpg,HealthPersonalCare,,false
B07HBMB3WW,"Drools Adult Dry Dog Food Chicken and Egg, 3kg with Free 1.2kg, Total 4.2 kg Pack",763,849,₹,10,86,https://www.amazon.in/dp/B07HBMB3WW?tag=discount0e8e-21&linkCode=osi&th=1&psc=1,https://m.media-amazon.com/images/I/41nXO0RsQdL._SL160_.jpg,PetSupplies,,false
B0744GC2CK,"L'Oréal Professionnel Absolut Repair Shampoo for Dry & Damaged Hair - 300ml | Professional shampoo for Strengthening and Repairing Hair, With Protein & Omega-9, For Men & Women",670,750,₹,10,80,https://www.amazon.in/dp/B0744GC2CK?tag=discount0e8e-21&linkCode=osi&th=1&psc=1,https://m.media-amazon.com/images/I/316mNphZuPL._SL160_.jpg,LuxuryBeauty,,false
B078HC9V8B,"Exo Dishwash Bar, 480gm (120gm X (3 + 1 Bar Free) | Goodness Of Ginger | Remove Tough Grime, Kills Bacteria & Sanitizes The Utensils",27,30,₹,10,3,https://www.amazon.in/dp/B078HC9V8B?tag=discount0e8e-21&linkCode=osi&th=1&psc=1,https://m.media-amazon.com/images/I/41Ni-rXQ+1L._SL160_.jpg,HomeAndKitchen,,false
B0757631XR,"Fortune Premium Kachi Ghani Pure Mustard Oil, 910G PET Bottle (Weight May Vary)",285,320,₹,10,35,https://www.amazon.in/dp/B0757631XR?tag=discount0e8e-21&linkCode=osi&th=1&psc=1,https://m.media-amazon.com/images/I/419b2v55pWL._SL160_.jpg,HealthPersonalCare,,false
0241252083,"White Nights – Fyodor Dostoyevsky | A Million-Copy Bestseller | A Timeless Story of Love, Longing & Solitude – Penguin Classics",112,125,₹,10,13,https://www.amazon.in/dp/0241252083?tag=discount0e8e-21&linkCode=osi&th=1&psc=1,https://m.media-amazon.com/images/I/21tZxguVHuL._SL160_.jpg,Books,,false
B0C86RTS5X,Good Knight Flash Liquid Vaporiser | Pack Of 4 (45ml Each) | Lavender Fragrance | 2x Faster Than Before | Mosquito Repellent Refill | India s Most Powerful Liquid Vaporizer,281,310,₹,9,29,https://www.amazon.in/dp/B0C86RTS5X?tag=discount0e8e-21&linkCode=osi&th=1&psc=1,https://m.media-amazon.com/images/I/41Ivz3iQ3-L._SL160_.jpg,GardenAndOutdoor,,false
B09RWTYMCF,"ShineXPro Microfiber Car Cleaning Cloth - OG Soft 500 GSM Extra Large (35x75 CM) Microfiber Cloth for Car and Bike - Suede Edging for Scratchless Drying and Detailing (Pack of 2, Grey)",499,549,₹,9,50,https://www.amazon.in/dp/B09RWTYMCF?tag=discount0e8e-21&linkCode=osi&th=1&psc=1,https://m.media-amazon.com/images/I/51cqkNHSdXL._SL160_.jpg,Automotive,,false
B00RJQ8XHU,Jopasu Car Duster,785,869,₹,9,84,https://www.amazon.in/dp/B00RJQ8XHU?tag=discount0e8e-21&linkCode=osi&th=1&psc=1,https://m.media-amazon.com/images/I/41-aBYgAYtL._SL160_.jpg,Automotive,,false
B0BQJMKZCR,L'Oréal Professionnel Serie Expert Density Advanced Shampoo – 300 ml | For fine and thinning Hair | Adds bounce and volume | With Omega-6 complex,679,745,₹,8,66,https://www.amazon.in/dp/B0BQJMKZCR?tag=discount0e8e-21&linkCode=osi&th=1&psc=1,https://m.media-amazon.com/images/I/31hAkIDUT0L._SL160_.jpg,LuxuryBeauty,,false
B0CNLTF152,"Duracell LED Torch Light, Super Bright, 12000 LUX, Ultra-Light and Easy to Carry Design, Large Reflector, for Everyday Use, 3AA Batteries Free, Black",179,195,₹,8,16,https://www.amazon.in/dp/B0CNLTF152?tag=discount0e8e-21&linkCode=osi&th=1&psc=1,https://m.media-amazon.com/images/I/41HEJivIZzL._SL160_.jpg,Luggage,,false
B0BYKSXHYK,PNG Jewellers 2 gm Vedhani Gold coin 24 kt (995),26974,29405,₹,8,2431,https://www.amazon.in/dp/B0BYKSXHYK?tag=discount0e8e-21&linkCode=osi&th=1&psc=1,https://m.media-amazon.com/images/I/3162roNX0yL._SL160_.jpg,Jewelry,,false
B00VFMFXRC,All Out Ultra Mosquito Repellant Refill Faster Action (45 mL each) Pack of 6,399,438,₹,8,39,https://www.amazon.in/dp/B00VFMFXRC?tag=discount0e8e-21&linkCode=osi&th=1&psc=1,https://m.media-amazon.com/images/I/51X9JVMp6HL._SL160_.jpg,GardenAndOutdoor,,false
B0BRP4LVN2,Casio Enticer Men Analog Green Dial Men MTP-1302PD-3AVEF (A2262),3681,3995,₹,7,314,https://www.amazon.in/dp/B0BRP4LVN2?tag=discount0e8e-21&linkCode=osi&th=1&psc=1,https://m.media-amazon.com/images/I/41+ES4+cPBL._SL160_.jpg,Watches,,false
B0DKFX8THB,Black Myth: Wukong for Playstation 5,6489,6999,₹,7,510,https://www.amazon.in/dp/B0DKFX8THB?tag=discount0e8e-21&linkCode=osi&th=1&psc=1,https://m.media-amazon.com/images/I/51YzZ+l72JL._SL160_.jpg,MoviesAndTV,,false
B07S2XJVLD,Cello Whitemate Whiteboard BoldMarkers | Set of 6 | Assorted Ink Colours | Whiteboard Marker with Easily Erasable Ink | Refillable Whiteboard Markers Markers,140,150,₹,6,10,https://www.amazon.in/dp/B07S2XJVLD?tag=discount0e8e-21&linkCode=osi&th=1&psc=1,https://m.media-amazon.com/images/I/41m8K4Ef2LL._SL160_.jpg,OfficeProducts,,false
B0BYLK9PZT,PNG Jewellers 10 gm Vedhani Gold coin 24 kt (995),134857,144700,₹,6,9843,https://www.amazon.in/dp/B0BYLK9PZT?tag=discount0e8e-21&linkCode=osi&th=1&psc=1,https://m.media-amazon.com/images/I/3162roNX0yL._SL160_.jpg,Jewelry,,false
B0BMGP89P1,"Purepet Ocean Fish Adult Dry Cat Food, 1 kg",189,199,₹,5,10,https://www.amazon.in/dp/B0BMGP89P1?tag=discount0e8e-21&linkCode=osi&th=1&psc=1,https://m.media-amazon.com/images/I/415ncxK9zpL._SL160_.jpg,PetSupplies,,false
B07WH38Z6Z,"Hit Flying Insect Killer - Mosquito & Fly Killer Spray (700Ml) | Instant Kill | Protection From Dengue & Malaria, Pack Of 1",285,300,₹,5,15,https://www.amazon.in/dp/B07WH38Z6Z?tag=discount0e8e-21&linkCode=osi&th=1&psc=1,https://m.media-amazon.com/images/I/31nuozuBoBL._SL160_.jpg,GardenAndOutdoor,,false
B00ISNVQMW,Titan Karishma Analog Black Dial Men's Watch NM1639SM02/NN1639SM02,1906,1995,₹,4,89,https://www.amazon.in/dp/B00ISNVQMW?tag=discount0e8e-21&linkCode=osi&th=1&psc=1,https://m.media-amazon.com/images/I/31sFbhco+PL._SL160_.jpg,Watches,,false
B00LHS8I3A,"Pedigree Adult Dry Dog Food, Chicken & Vegetables, 3 kg, Contains 37 Essential Nutrients, 100% Complete & Balanced Food for Adult Dogs",694,730,₹,4,36,https://www.amazon.in/dp/B00LHS8I3A?tag=discount0e8e-21&linkCode=osi&th=1&psc=1,https://m.media-amazon.com/images/I/41hmg1Ku4EL._SL160_.jpg,PetSupplies,,false
B01HO9EC94,Biolage Smoothproof Deep Smoothing 6-In-1 Professional Hair Serum For Women & Men For Frizzy Hair,312,325,₹,4,13,https://www.amazon.in/dp/B01HO9EC94?tag=discount0e8e-21&linkCode=osi&th=1&psc=1,https://m.media-amazon.com/images/I/31aCpIcMrnL._SL160_.jpg,LuxuryBeauty,,false
B0BZ3Z5D56,Scotch Brite Scrub Sponge -Pack of 3 for everyday utensil cleaning (Kitchen Scrubber with Sponge),54,55,₹,1,1,https://www.amazon.in/dp/B0BZ3Z5D56?tag=discount0e8e-21&linkCode=osi&th=1&psc=1,https://m.media-amazon.com/images/I/51xADb-cPCL._SL160_.jpg,OfficeProducts,,false
B0BLVCFK8D,Casio FX-991CW Classwiz Non-Programmable Scientific Calculator,1564,1595,₹,1,31,https://www.amazon.in/dp/B0BLVCFK8D?tag=discount0e8e-21&linkCode=osi&th=1&psc=1,https://m.media-amazon.com/images/I/41mVTwoikiL._SL160_.jpg,OfficeProducts,,false
B07B4KQRZG,"MAGGI 2-Minute Instant Noodles, Masala Noodles With Goodness Of Iron, Made With Choicest Quality Spices, Favourite Masala Taste, 840/900g Pouch (Pack of 12, 70/75g each) (weight may vary)",165,168,₹,1,3,https://www.amazon.in/dp/B07B4KQRZG?tag=discount0e8e-21&linkCode=osi&th=1&psc=1,https://m.media-amazon.com/images/I/51S09OoiaxL._SL160_.jpg,HealthPersonalCare,,false
B00HFPIIOI,Casio Youth Series Digital Black Dial Unisex Watch - F-91W-1Q(D002),1295,1295,₹,0,0,https://www.amazon.in/dp/B00HFPIIOI?tag=discount0e8e-21&linkCode=osi&th=1&psc=1,https://m.media-amazon.com/images/I/41Nhuk9uzwL._SL160_.jpg,Watches,,false
B07K6RYVHR,Rs.1000 Sony PlayStation Store Gift Card (Email Delivery in 1 hour- Digital Voucher Code),1000,1000,₹,0,0,https://www.amazon.in/dp/B07K6RYVHR?tag=discount0e8e-21&linkCode=osi&th=1&psc=1,https://m.media-amazon.com/images/I/31OBA8Dh71L._SL160_.jpg,VideoGames,,false
B0C1H473H8,Playstation | E-Gift Card | Instant Delivery | Valid for in-game purchases,1000,1000,₹,0,0,https://www.amazon.in/dp/B0C1H473H8?tag=discount0e8e-21&linkCode=osi&th=1&psc=1,https://m.media-amazon.com/images/I/41xSlLlDM0L._SL160_.jpg,VideoGames,,false
B07CR1JQBY,Titan Karishma Analog Champagne Dial Women's Watch -NM2598YM01 / NL2598YM01,1995,1995,₹,0,0,https://www.amazon.in/dp/B07CR1JQBY?tag=discount0e8e-21&linkCode=osi&th=1&psc=1,https://m.media-amazon.com/images/I/317ulYCaYsL._SL160_.jpg,Watches,,false
B079T88XLM,"Meat Up Dog Treats Biscuits Real Chicken Flavour, 1+1kg (Buy 1 Get 1 Free), Total 2 kg Pack",398,398,₹,0,0,https://www.amazon.in/dp/B079T88XLM?tag=discount0e8e-21&linkCode=osi&th=1&psc=1,https://m.media-amazon.com/images/I/51s+T+8Rb6L._SL160_.jpg,PetSupplies,,false
B0CQJTM6TW,"RENEE Midnight Kohl Kajal Pencil | Waterproof, Smudgeproof With Sharpener | 24 Hours Long Stay | Darkest Black | One Swipe Application | Vitamin E, Olive Oil and Castor Oil | Matte Finish |1.5 Gm",389,389,₹,0,0,https://www.amazon.in/dp/B0CQJTM6TW?tag=discount0e8e-21&linkCode=osi&th=1&psc=1,https://m.media-amazon.com/images/I/31Zm5pIfIpL._SL160_.jpg,PetSupplies,,false
B00MVV9NUY,"JK Easy Copier Paper | A4 Size | 70 GSM | 500 Sheets | White Paper, 1 Ream | For Laserjet & Inkjet Printer | Fast Drying | Both Side Print | Eco Friendly | ColorLok (Pack of 1) | One Ream",354,354,₹,0,0,https://www.amazon.in/dp/B00MVV9NUY?tag=discount0e8e-21&linkCode=osi&th=1&psc=1,https://m.media-amazon.com/images/I/41LcujaPSvL._SL160_.jpg,OfficeProducts,,false
B0FKC1YLLF,Saregama Vinyl Record - Gulzar's Fursat Ke Raat Din,3590,3590,₹,0,0,https://www.amazon.in/dp/B0FKC1YLLF?tag=discount0e8e-21&linkCode=osi&th=1&psc=1,https://m.media-amazon.com/images/I/41erVZoYdlL._SL160_.jpg,Music,,false
B0FG3CCJ3Z,"Saregama Vinyl Record - Close To My Heart - Jagjit Singh, 11 Evergreen Hindi Superhit Songs",3590,3590,₹,0,0,https://www.amazon.in/dp/B0FG3CCJ3Z?tag=discount0e8e-21&linkCode=osi&th=1&psc=1,https://m.media-amazon.com/images/I/41agNxTHn8L._SL160_.jpg,Music,,false
B076X8FKXP,Fawesome - Free Awesome TV & Movies,0,0,₹,0,0,https://www.amazon.in/dp/B076X8FKXP?tag=discount0e8e-21&linkCode=osi&th=1&psc=1,https://m.media-amazon.com/images/I/81VLg+9NcRL._SL160_.png,MobileApps,,false
B0FG3F2KN4,"Saregama Vinyl Record - Romance - RD Burman, 10 Evergreen Hindi Superhit Songs",3590,3590,₹,0,0,https://www.amazon.in/dp/B0FG3F2KN4?tag=discount0e8e-21&linkCode=osi&th=1&psc=1,https://m.media-amazon.com/images/I/41qL3ZbDiuL._SL160_.jpg,Music,,false
B09YRTDSG4,DIL SE - COLOURED LP [Vinyl] A R RAHMAN,2499,2499,₹,0,0,https://www.amazon.in/dp/B09YRTDSG4?tag=discount0e8e-21&linkCode=osi&th=1&psc=1,https://m.media-amazon.com/images/I/41ijbRF43qL._SL160_.jpg,Music,,false
B07X6GNBNT,Credit Card Bill,10,10,₹,0,0,https://www.amazon.in/dp/B07X6GNBNT?tag=discount0e8e-21&linkCode=osi&th=1&psc=1,https://m.media-amazon.com/images/I/21Z-i0dyzKL._SL160_.jpg,Luggage,,false
B0B2DFQWXJ,"Dil Se – SVR 003 - New Release Hindi LP Vinyl Record, A. R. Rahman, Sukhwinder Singh",2499,2499,₹,0,0,https://www.amazon.in/dp/B0B2DFQWXJ?tag=discount0e8e-21&linkCode=osi&th=1&psc=1,https://m.media-amazon.com/images/I/41ijbRF43qL._SL160_.jpg,Music,,false
B087G5BN7Z,"discovery+ | TV Shows, Shorts, Fun Learning",0,0,₹,0,0,https://www.amazon.in/dp/B087G5BN7Z?tag=discount0e8e-21&linkCode=osi&th=1&psc=1,https://m.media-amazon.com/images/I/71UCyJsuqfL._SL160_.png,MobileApps,,false
B0FN4CVB6X,ARADHANA S. D. BURMAN LP Vinyl Record,3590,3590,₹,0,0,https://www.amazon.in/dp/B0FN4CVB6X?tag=discount0e8e-21&linkCode=osi&th=1&psc=1,https://m.media-amazon.com/images/I/51gl2B1NlvL._SL160_.jpg,Music,,false
B0FM3DXSHB,PAYANANGAL MUDIVATHILLAI - LP,2499,2499,₹,0,0,https://www.amazon.in/dp/B0FM3DXSHB?tag=discount0e8e-21&linkCode=osi&th=1&psc=1,https://m.media-amazon.com/images/I/41bTozxZWyL._SL160_.jpg,Music,,false
B0F2SP6N5L,VINNATHAANDI VARUVAAYAA - BLACK LP (TAMIL),2499,2499,₹,0,0,https://www.amazon.in/dp/B0F2SP6N5L?tag=discount0e8e-21&linkCode=osi&th=1&psc=1,https://m.media-amazon.com/images/I/51ltVX7bdAL._SL160_.jpg,Music,,false
B0FKBX7C32,Saregama Vinyl Record - Love Duets - Lata Mangeshkar & Kishore Kumar,3590,3590,₹,0,0,https://www.amazon.in/dp/B0FKBX7C32?tag=discount0e8e-21&linkCode=osi&th=1&psc=1,https://m.media-amazon.com/images/I/41ZHgH5KGVL._SL160_.jpg,Music,,false
B0077BGWNY,Matrubhoomi - A Nation Without Women,398,398,₹,0,0,https://www.amazon.in/dp/B0077BGWNY?tag=discount0e8e-21&linkCode=osi&th=1&psc=1,https://m.media-amazon.com/images/I/514+r7NX+LL._SL160_.jpg,MoviesAndTV,,false
